<?xml version="1.0"?>
<!DOCTYPE Report
[
<!ELEMENT Report (General ,(Doc|BPT)) >
<!ATTLIST Report ver CDATA #REQUIRED tmZone CDATA #REQUIRED>

<!ELEMENT General ( DocLocation ) >
<!ATTLIST General productName CDATA #REQUIRED productVer CDATA #REQUIRED os CDATA #REQUIRED host CDATA #REQUIRED qcserver CDATA #IMPLIED qcproject CDATA #IMPLIED SolManSolutionId CDATA #IMPLIED SolManProjectId CDATA #IMPLIED SolManTestPlanId CDATA #IMPLIED SolManTestPackageId CDATA #IMPLIED SolManUserInfoData CDATA #IMPLIED  >

<!ELEMENT BPT (DName,Res,DVer?,TSet?,TInst?,NodeArgs,AdditionalInfo*,Doc*) >
<!ATTLIST BPT rID ID #REQUIRED >

<!ELEMENT Doc (DName,ConfName?,Res,DVer?,TSet?,TInst?,RunType?,DT?,AdditionalInfo*,Step*,DIter*,Step*,Action*,Doc*,Summary?,TestMaintenanceSummary*,NodeArgs?) >
<!ATTLIST Doc rID ID #REQUIRED type (Test|BC|BPTWrapperTest|Flow|Group|Action) "Test" productName CDATA #REQUIRED BCIter CDATA #IMPLIED >

<!ELEMENT RunType ( #PCDATA )>
<!ATTLIST RunType fmStep (False|True) "False" batch (False|True) "False" upDesc (False|True) "False" upChk (False|True) "False" upAS (False|True) "False">

<!ELEMENT DName ( #PCDATA ) >

<!ELEMENT ConfName ( #PCDATA ) >

<!ELEMENT Res ( #PCDATA ) >

<!ELEMENT AdditionalInfo (AdditionalDataName,AdditionalDataValue ) >

<!ELEMENT AdditionalDataName ( #PCDATA ) >

<!ELEMENT AdditionalDataValue ( #PCDATA ) >

<!ELEMENT DVer ( #PCDATA ) >

<!ELEMENT TSet ( #PCDATA ) >

<!ELEMENT TInst ( #PCDATA ) >

<!ELEMENT DIter (Step*,Action+,Summary?,NodeArgs)>
<!ATTLIST DIter rID ID #REQUIRED iterID CDATA #REQUIRED>

<!ELEMENT DocLocation ( #PCDATA )>

<!ELEMENT Action (AName,AIter*,(Step|HtmlStep|Action)*, Summary,ActionMaintenanceSummary*, NodeArgs ) >
<!ATTLIST Action rID ID #REQUIRED>

<!ELEMENT AIter ((Step|HtmlStep|Action)*,DataMapping?, Summary?,NodeArgs) >
<!ATTLIST AIter rID ID #REQUIRED iterID CDATA #REQUIRED isCountable (False|True) "False" >

<!ELEMENT AName ( #PCDATA ) >

<!ELEMENT TestMaintenanceSummary (ActionMaintenanceSummary*) >
<!ATTLIST TestMaintenanceSummary ObjectsAdded CDATA #REQUIRED ObjectsUpdated CDATA #REQUIRED StepsUpdated CDATA #REQUIRED StepsComments CDATA #REQUIRED><!ELEMENT ActionMaintenanceSummary (ObjectChange* ) >
<!ATTLIST ActionMaintenanceSummary Action CDATA #REQUIRED Objects CDATA #REQUIRED Updated CDATA #REQUIRED LinesTotal CDATA #REQUIRED Added CDATA #REQUIRED LinesUpdated CDATA #REQUIRED>

<!ELEMENT ObjectChange  (Hierarchy, PropertyChangeList* ) >
<!ATTLIST ObjectChange Operation CDATA #IMPLIED OriginalRepository CDATA #IMPLIED>

<!ELEMENT PropertyChangeList (PropertyDef*) >

<!ELEMENT PropertyDef (OriginalValue, NewValue) >
<!ATTLIST PropertyDef PropName CDATA #REQUIRED OriginRegularExpression (True|False) "False" NewRegularExpression (True|False) "False" AddedProperty (True|False) "False" >

<!ELEMENT OriginalValue ( #PCDATA )>

<!ELEMENT NewValue ( #PCDATA )>

<!ELEMENT Hierarchy  (ObjectName, Hierarchy*) >
<!ATTLIST Hierarchy MicClass CDATA #REQUIRED>

<!ELEMENT ObjectName  ( #PCDATA ) >

<!ELEMENT Step (Obj,Details,Time,TimeTick* ,(Step|HtmlStep|Doc)*, DataMapping?, NodeArgs) >
<!ATTLIST Step rID ID #REQUIRED retval CDATA #IMPLIED>

<!ELEMENT HtmlStep (HTML,TimeTick*,(Step|HtmlStep|Doc)*,NodeArgs) >
<!ATTLIST HtmlStep rID ID #REQUIRED >

<!ELEMENT Obj ( #PCDATA ) >
<!ATTLIST Obj plainTxt (False|True) "True">

<!ELEMENT Details ( #PCDATA ) >
<!ATTLIST Details plainTxt (False|True) "True">

<!ELEMENT Time ( #PCDATA ) >

<!ELEMENT HTML ( #PCDATA ) >

<!ELEMENT Disp ( #PCDATA ) >

<!ELEMENT TimeTick ( #PCDATA ) >

<!ELEMENT DataMapping ( DataMappedItem* )>
<!ELEMENT DataMappedItem EMPTY >
<!ATTLIST DataMappedItem dsName CDATA #REQUIRED >
<!ATTLIST DataMappedItem rowId CDATA #REQUIRED >

<!ELEMENT NodeArgs (Disp,TopPane?,BtmPane?,ExtendedInfo? )>
<!ATTLIST NodeArgs eType CDATA #REQUIRED icon CDATA #REQUIRED nRep CDATA #REQUIRED UserNote CDATA #IMPLIED filter (False|True) "True">
<!ATTLIST NodeArgs status (Passed|Failed|Done|Warning|Information) "Done">
<!ATTLIST NodeArgs iconSel CDATA #IMPLIED nType CDATA #IMPLIED MovieMarker CDATA "">
<!ATTLIST NodeArgs Source CDATA #IMPLIED SourceLine CDATA #IMPLIED StepFlowItemKey CDATA #IMPLIED >

<!ELEMENT TopPane (Path)>

<!ELEMENT BtmPane ( (Path|WR)?,ASHilite?)>
<!ATTLIST BtmPane vType CDATA "HTML">

<!ELEMENT Path ( #PCDATA ) >

<!ELEMENT ASHilite ( #PCDATA ) >

<!ELEMENT WR ( #PCDATA ) >

<!ELEMENT ExtendedInfo ( StepData ) >

<!ATTLIST ExtendedInfo StepType CDATA #REQUIRED>
<!ELEMENT DT (NodeArgs) >
<!ATTLIST DT rID ID #REQUIRED>

<!ELEMENT Summary (Param*)>
<!ATTLIST Summary sTime CDATA #IMPLIED eTime CDATA #IMPLIED passed CDATA #IMPLIED failed CDATA #IMPLIED warnings CDATA #IMPLIED retval CDATA #IMPLIED stopped (False|True) "False" >

<!ELEMENT Param (ParamName,ParamVal)+ >
<!ATTLIST Param paramInOut (In|Out) "In">

<!ELEMENT ParamName ( #PCDATA ) >

<!ELEMENT ParamVal ( #PCDATA ) >

]
>
<Report ver="2.0" tmZone="India Standard Time">
<General productName="Micro Focus Unified Functional Testing" productVer="14.50" os="" host="INLEN8520024624"><DocLocation><![CDATA[C:\Payback\Payback_Project]]></DocLocation></General>
<Doc rID="T1"   productName= "Micro Focus Unified Functional Testing"  >
<DName><![CDATA[Payback_Project]]></DName>
<Res><![CDATA[Res154]]></Res>
<DT rID="T2">
<NodeArgs eType="Table" icon="2" nRep="4" filter="False" >
<Disp><![CDATA[Run-Time Data Table]]></Disp>
<BtmPane vType="Table" >
<Path><![CDATA[Default.xls]]></Path>
</BtmPane>
</NodeArgs>
</DT>
<DIter rID="T3" iterID="1" >
<Action rID="T4">
<AName><![CDATA[Login]]></AName>
<Step rID="T5">
<Obj plainTxt="False" ><![CDATA[Zillion - aha, everywhere!_2]]></Obj>
<Details plainTxt="False" ><![CDATA[<table><tr><td><span style="text-align : left; font-size : 12px; ">Local Browser</span></td></tr></table>]]></Details>
<Time><![CDATA[07-09-2023 - 15:41:56]]></Time>
<TimeTick>1694081516</TimeTick>
<Step rID="T6">
<Obj plainTxt="False" ><![CDATA[Zillion - aha, everywhere!]]></Obj>
<Details plainTxt="False" ><![CDATA[Page]]></Details>
<Time><![CDATA[07-09-2023 - 15:41:56]]></Time>
<TimeTick>1694081516</TimeTick>
<Step rID="T7">
<Obj plainTxt="False" ><![CDATA[WebElement.Exist]]></Obj>
<Details plainTxt="False" ><![CDATA["Object does not exist"]]></Details>
<Time><![CDATA[07-09-2023 - 15:41:56]]></Time>
<TimeTick>1694081516</TimeTick>
<NodeArgs eType="Replay" icon="7" nRep="159" >
<Disp><![CDATA[WebElement.Exist]]></Disp>
</NodeArgs>
</Step>
<NodeArgs eType="Context" icon="6" nRep="158" >
<Disp><![CDATA[Zillion - aha, everywhere!]]></Disp>
</NodeArgs>
</Step>
<NodeArgs eType="Context" icon="5" nRep="157" >
<Disp><![CDATA[Zillion - aha, everywhere!_2]]></Disp>
</NodeArgs>
</Step>
<Step rID="T8">
<Obj ><![CDATA[Ledger is working]]></Obj>
<Details ><![CDATA[PASSED]]></Details>
<Time><![CDATA[07-09-2023 - 15:41:56]]></Time>
<TimeTick>1694081516</TimeTick>
<NodeArgs eType="User" icon="8" nRep="160" status="Passed" >
<Disp><![CDATA[Ledger is working]]></Disp>
</NodeArgs>
</Step>
<Step rID="T9">
<Obj plainTxt="False" ><![CDATA[Zillion - aha, everywhere!_2]]></Obj>
<Details plainTxt="False" ><![CDATA[<table><tr><td><span style="text-align : left; font-size : 12px; ">Local Browser</span></td></tr></table>]]></Details>
<Time><![CDATA[07-09-2023 - 15:42:16]]></Time>
<TimeTick>1694081536</TimeTick>
<Step rID="T10">
<Obj plainTxt="False" ><![CDATA[Profile | Zillion - aha,]]></Obj>
<Details plainTxt="False" ><![CDATA[Page]]></Details>
<Time><![CDATA[07-09-2023 - 15:42:16]]></Time>
<TimeTick>1694081536</TimeTick>
<Step rID="T11">
<Obj plainTxt="False" ><![CDATA[Your Orders.Exist]]></Obj>
<Details plainTxt="False" ><![CDATA["Object does not exist"]]></Details>
<Time><![CDATA[07-09-2023 - 15:42:16]]></Time>
<TimeTick>1694081536</TimeTick>
<NodeArgs eType="Replay" icon="7" nRep="312" >
<Disp><![CDATA[Your Orders.Exist]]></Disp>
</NodeArgs>
</Step>
<NodeArgs eType="Context" icon="6" nRep="311" >
<Disp><![CDATA[Profile | Zillion - aha,]]></Disp>
</NodeArgs>
</Step>
<NodeArgs eType="Context" icon="5" nRep="310" >
<Disp><![CDATA[Zillion - aha, everywhere!_2]]></Disp>
</NodeArgs>
</Step>
<Step rID="T12">
<Obj ><![CDATA[Orders not found]]></Obj>
<Details ><![CDATA[FAILED]]></Details>
<Time><![CDATA[07-09-2023 - 15:42:16]]></Time>
<TimeTick>1694081536</TimeTick>
<NodeArgs eType="User" icon="8" nRep="313" status="Failed" >
<Disp><![CDATA[Orders not found]]></Disp>
</NodeArgs>
</Step>
<Step rID="T13">
<Obj plainTxt="False" ><![CDATA[Zillion - aha, everywhere!_2]]></Obj>
<Details plainTxt="False" ><![CDATA[<table><tr><td><span style="text-align : left; font-size : 12px; ">Local Browser</span></td></tr></table>]]></Details>
<Time><![CDATA[07-09-2023 - 15:42:16]]></Time>
<TimeTick>1694081536</TimeTick>
<Step rID="T14">
<Obj plainTxt="False" ><![CDATA[Profile | Zillion - aha,]]></Obj>
<Details plainTxt="False" ><![CDATA[Page]]></Details>
<Time><![CDATA[07-09-2023 - 15:42:16]]></Time>
<TimeTick>1694081536</TimeTick>
<Step rID="T15">
<Obj plainTxt="False" ><![CDATA[Profile | Zillion - aha,.Exist]]></Obj>
<Details plainTxt="False" ><![CDATA["Object exists"]]></Details>
<Time><![CDATA[07-09-2023 - 15:42:16]]></Time>
<TimeTick>1694081536</TimeTick>
<NodeArgs eType="Replay" icon="6" nRep="317" >
<Disp><![CDATA[Profile | Zillion - aha,.Exist]]></Disp>
</NodeArgs>
</Step>
<NodeArgs eType="Context" icon="6" nRep="316" >
<Disp><![CDATA[Profile | Zillion - aha,]]></Disp>
</NodeArgs>
</Step>
<NodeArgs eType="Context" icon="5" nRep="315" >
<Disp><![CDATA[Zillion - aha, everywhere!_2]]></Disp>
</NodeArgs>
</Step>
<Step rID="T16">
<Obj ><![CDATA[All Found]]></Obj>
<Details ><![CDATA[PASSED]]></Details>
<Time><![CDATA[07-09-2023 - 15:42:16]]></Time>
<TimeTick>1694081536</TimeTick>
<NodeArgs eType="User" icon="8" nRep="318" status="Passed" >
<Disp><![CDATA[All Found]]></Disp>
</NodeArgs>
</Step>
<Step rID="T17">
<Obj plainTxt="False" ><![CDATA[Zillion - aha, everywhere!_2]]></Obj>
<Details plainTxt="False" ><![CDATA[<table><tr><td><span style="text-align : left; font-size : 12px; ">Local Browser</span></td></tr></table>]]></Details>
<Time><![CDATA[07-09-2023 - 15:42:16]]></Time>
<TimeTick>1694081536</TimeTick>
<Step rID="T18">
<Obj plainTxt="False" ><![CDATA[Profile | Zillion - aha,]]></Obj>
<Details plainTxt="False" ><![CDATA[Page]]></Details>
<Time><![CDATA[07-09-2023 - 15:42:16]]></Time>
<TimeTick>1694081536</TimeTick>
<Step rID="T19">
<Obj plainTxt="False" ><![CDATA[Profile | Zillion - aha,.Exist]]></Obj>
<Details plainTxt="False" ><![CDATA["Object exists"]]></Details>
<Time><![CDATA[07-09-2023 - 15:42:16]]></Time>
<TimeTick>1694081536</TimeTick>
<NodeArgs eType="Replay" icon="6" nRep="322" >
<Disp><![CDATA[Profile | Zillion - aha,.Exist]]></Disp>
</NodeArgs>
</Step>
<NodeArgs eType="Context" icon="6" nRep="321" >
<Disp><![CDATA[Profile | Zillion - aha,]]></Disp>
</NodeArgs>
</Step>
<NodeArgs eType="Context" icon="5" nRep="320" >
<Disp><![CDATA[Zillion - aha, everywhere!_2]]></Disp>
</NodeArgs>
</Step>
<Step rID="T20">
<Obj ><![CDATA[Earned Found]]></Obj>
<Details ><![CDATA[PASSED]]></Details>
<Time><![CDATA[07-09-2023 - 15:42:16]]></Time>
<TimeTick>1694081536</TimeTick>
<NodeArgs eType="User" icon="8" nRep="323" status="Passed" >
<Disp><![CDATA[Earned Found]]></Disp>
</NodeArgs>
</Step>
<Step rID="T21">
<Obj plainTxt="False" ><![CDATA[Zillion - aha, everywhere!_2]]></Obj>
<Details plainTxt="False" ><![CDATA[<table><tr><td><span style="text-align : left; font-size : 12px; ">Local Browser</span></td></tr></table>]]></Details>
<Time><![CDATA[07-09-2023 - 15:42:16]]></Time>
<TimeTick>1694081536</TimeTick>
<Step rID="T22">
<Obj plainTxt="False" ><![CDATA[Profile | Zillion - aha,]]></Obj>
<Details plainTxt="False" ><![CDATA[Page]]></Details>
<Time><![CDATA[07-09-2023 - 15:42:16]]></Time>
<TimeTick>1694081536</TimeTick>
<Step rID="T23">
<Obj plainTxt="False" ><![CDATA[Profile | Zillion - aha,.Exist]]></Obj>
<Details plainTxt="False" ><![CDATA["Object exists"]]></Details>
<Time><![CDATA[07-09-2023 - 15:42:16]]></Time>
<TimeTick>1694081536</TimeTick>
<NodeArgs eType="Replay" icon="6" nRep="327" >
<Disp><![CDATA[Profile | Zillion - aha,.Exist]]></Disp>
</NodeArgs>
</Step>
<NodeArgs eType="Context" icon="6" nRep="326" >
<Disp><![CDATA[Profile | Zillion - aha,]]></Disp>
</NodeArgs>
</Step>
<NodeArgs eType="Context" icon="5" nRep="325" >
<Disp><![CDATA[Zillion - aha, everywhere!_2]]></Disp>
</NodeArgs>
</Step>
<Step rID="T24">
<Obj ><![CDATA[Expired Found]]></Obj>
<Details ><![CDATA[PASSED]]></Details>
<Time><![CDATA[07-09-2023 - 15:42:16]]></Time>
<TimeTick>1694081536</TimeTick>
<NodeArgs eType="User" icon="8" nRep="328" status="Passed" >
<Disp><![CDATA[Expired Found]]></Disp>
</NodeArgs>
</Step>
<Step rID="T25">
<Obj plainTxt="False" ><![CDATA[Zillion - aha, everywhere!_2]]></Obj>
<Details plainTxt="False" ><![CDATA[<table><tr><td><span style="text-align : left; font-size : 12px; ">Local Browser</span></td></tr></table>]]></Details>
<Time><![CDATA[07-09-2023 - 15:42:17]]></Time>
<TimeTick>1694081537</TimeTick>
<Step rID="T26">
<Obj plainTxt="False" ><![CDATA[Profile | Zillion - aha,]]></Obj>
<Details plainTxt="False" ><![CDATA[Page]]></Details>
<Time><![CDATA[07-09-2023 - 15:42:17]]></Time>
<TimeTick>1694081537</TimeTick>
<Step rID="T27">
<Obj plainTxt="False" ><![CDATA[Profile | Zillion - aha,.Exist]]></Obj>
<Details plainTxt="False" ><![CDATA["Object exists"]]></Details>
<Time><![CDATA[07-09-2023 - 15:42:17]]></Time>
<TimeTick>1694081537</TimeTick>
<NodeArgs eType="Replay" icon="6" nRep="332" >
<Disp><![CDATA[Profile | Zillion - aha,.Exist]]></Disp>
</NodeArgs>
</Step>
<NodeArgs eType="Context" icon="6" nRep="331" >
<Disp><![CDATA[Profile | Zillion - aha,]]></Disp>
</NodeArgs>
</Step>
<NodeArgs eType="Context" icon="5" nRep="330" >
<Disp><![CDATA[Zillion - aha, everywhere!_2]]></Disp>
</NodeArgs>
</Step>
<Step rID="T28">
<Obj ><![CDATA[Redeemed Found]]></Obj>
<Details ><![CDATA[PASSED]]></Details>
<Time><![CDATA[07-09-2023 - 15:42:17]]></Time>
<TimeTick>1694081537</TimeTick>
<NodeArgs eType="User" icon="8" nRep="333" status="Passed" >
<Disp><![CDATA[Redeemed Found]]></Disp>
</NodeArgs>
</Step>
<Step rID="T29">
<Obj plainTxt="False" ><![CDATA[Zillion - aha, everywhere!_2]]></Obj>
<Details plainTxt="False" ><![CDATA[<table><tr><td><span style="text-align : left; font-size : 12px; ">Local Browser</span></td></tr></table>]]></Details>
<Time><![CDATA[07-09-2023 - 15:42:17]]></Time>
<TimeTick>1694081537</TimeTick>
<Step rID="T30">
<Obj plainTxt="False" ><![CDATA[Profile | Zillion - aha,]]></Obj>
<Details plainTxt="False" ><![CDATA[Page]]></Details>
<Time><![CDATA[07-09-2023 - 15:42:17]]></Time>
<TimeTick>1694081537</TimeTick>
<Step rID="T31">
<Obj plainTxt="False" ><![CDATA[Profile | Zillion - aha,.Exist]]></Obj>
<Details plainTxt="False" ><![CDATA["Object exists"]]></Details>
<Time><![CDATA[07-09-2023 - 15:42:17]]></Time>
<TimeTick>1694081537</TimeTick>
<NodeArgs eType="Replay" icon="6" nRep="337" >
<Disp><![CDATA[Profile | Zillion - aha,.Exist]]></Disp>
</NodeArgs>
</Step>
<NodeArgs eType="Context" icon="6" nRep="336" >
<Disp><![CDATA[Profile | Zillion - aha,]]></Disp>
</NodeArgs>
</Step>
<NodeArgs eType="Context" icon="5" nRep="335" >
<Disp><![CDATA[Zillion - aha, everywhere!_2]]></Disp>
</NodeArgs>
</Step>
<Step rID="T32">
<Obj ><![CDATA[Select Date Found]]></Obj>
<Details ><![CDATA[PASSED]]></Details>
<Time><![CDATA[07-09-2023 - 15:42:17]]></Time>
<TimeTick>1694081537</TimeTick>
<NodeArgs eType="User" icon="8" nRep="338" status="Passed" >
<Disp><![CDATA[Select Date Found]]></Disp>
</NodeArgs>
</Step>
<Step rID="T33">
<Obj plainTxt="False" ><![CDATA[Zillion - aha, everywhere!_2]]></Obj>
<Details plainTxt="False" ><![CDATA[<table><tr><td><span style="text-align : left; font-size : 12px; ">Local Browser</span></td></tr></table>]]></Details>
<Time><![CDATA[07-09-2023 - 15:42:17]]></Time>
<TimeTick>1694081537</TimeTick>
<Step rID="T34">
<Obj plainTxt="False" ><![CDATA[Profile | Zillion - aha,_2]]></Obj>
<Details plainTxt="False" ><![CDATA[Page]]></Details>
<Time><![CDATA[07-09-2023 - 15:42:17]]></Time>
<TimeTick>1694081537</TimeTick>
<Step rID="T35">
<Obj plainTxt="False" ><![CDATA[Profile | Zillion - aha,_2.Exist]]></Obj>
<Details plainTxt="False" ><![CDATA["Object exists"]]></Details>
<Time><![CDATA[07-09-2023 - 15:42:17]]></Time>
<TimeTick>1694081537</TimeTick>
<NodeArgs eType="Replay" icon="6" nRep="342" >
<Disp><![CDATA[Profile | Zillion - aha,_2.Exist]]></Disp>
</NodeArgs>
</Step>
<NodeArgs eType="Context" icon="6" nRep="341" >
<Disp><![CDATA[Profile | Zillion - aha,_2]]></Disp>
</NodeArgs>
</Step>
<NodeArgs eType="Context" icon="5" nRep="340" >
<Disp><![CDATA[Zillion - aha, everywhere!_2]]></Disp>
</NodeArgs>
</Step>
<Step rID="T36">
<Obj ><![CDATA[Orders Found]]></Obj>
<Details ><![CDATA[PASSED]]></Details>
<Time><![CDATA[07-09-2023 - 15:42:17]]></Time>
<TimeTick>1694081537</TimeTick>
<NodeArgs eType="User" icon="8" nRep="343" status="Passed" >
<Disp><![CDATA[Orders Found]]></Disp>
</NodeArgs>
</Step>
<Step rID="T37">
<Obj plainTxt="False" ><![CDATA[Zillion - aha, everywhere!_2]]></Obj>
<Details plainTxt="False" ><![CDATA[<table><tr><td><span style="text-align : left; font-size : 12px; ">Local Browser</span></td></tr></table>]]></Details>
<Time><![CDATA[07-09-2023 - 15:42:17]]></Time>
<TimeTick>1694081537</TimeTick>
<Step rID="T38">
<Obj plainTxt="False" ><![CDATA[Profile | Zillion - aha,]]></Obj>
<Details plainTxt="False" ><![CDATA[Page]]></Details>
<Time><![CDATA[07-09-2023 - 15:42:17]]></Time>
<TimeTick>1694081537</TimeTick>
<Step rID="T39">
<Obj plainTxt="False" ><![CDATA[Profile | Zillion - aha,.Exist]]></Obj>
<Details plainTxt="False" ><![CDATA["Object exists"]]></Details>
<Time><![CDATA[07-09-2023 - 15:42:17]]></Time>
<TimeTick>1694081537</TimeTick>
<NodeArgs eType="Replay" icon="6" nRep="347" >
<Disp><![CDATA[Profile | Zillion - aha,.Exist]]></Disp>
</NodeArgs>
</Step>
<NodeArgs eType="Context" icon="6" nRep="346" >
<Disp><![CDATA[Profile | Zillion - aha,]]></Disp>
</NodeArgs>
</Step>
<NodeArgs eType="Context" icon="5" nRep="345" >
<Disp><![CDATA[Zillion - aha, everywhere!_2]]></Disp>
</NodeArgs>
</Step>
<Step rID="T40">
<Obj ><![CDATA[Transactions Found]]></Obj>
<Details ><![CDATA[PASSED]]></Details>
<Time><![CDATA[07-09-2023 - 15:42:17]]></Time>
<TimeTick>1694081537</TimeTick>
<NodeArgs eType="User" icon="8" nRep="348" status="Passed" >
<Disp><![CDATA[Transactions Found]]></Disp>
</NodeArgs>
</Step>
<Step rID="T41">
<Obj plainTxt="False" ><![CDATA[Zillion - aha, everywhere!_2]]></Obj>
<Details plainTxt="False" ><![CDATA[<table><tr><td><span style="text-align : left; font-size : 12px; ">Local Browser</span></td></tr></table>]]></Details>
<Time><![CDATA[07-09-2023 - 15:42:17]]></Time>
<TimeTick>1694081537</TimeTick>
<Step rID="T42">
<Obj plainTxt="False" ><![CDATA[Profile | Zillion - aha,_2]]></Obj>
<Details plainTxt="False" ><![CDATA[Page]]></Details>
<Time><![CDATA[07-09-2023 - 15:42:17]]></Time>
<TimeTick>1694081537</TimeTick>
<Step rID="T43">
<Obj plainTxt="False" ><![CDATA[Profile | Zillion - aha,_2.Exist]]></Obj>
<Details plainTxt="False" ><![CDATA["Object exists"]]></Details>
<Time><![CDATA[07-09-2023 - 15:42:17]]></Time>
<TimeTick>1694081537</TimeTick>
<NodeArgs eType="Replay" icon="6" nRep="352" >
<Disp><![CDATA[Profile | Zillion - aha,_2.Exist]]></Disp>
</NodeArgs>
</Step>
<NodeArgs eType="Context" icon="6" nRep="351" >
<Disp><![CDATA[Profile | Zillion - aha,_2]]></Disp>
</NodeArgs>
</Step>
<NodeArgs eType="Context" icon="5" nRep="350" >
<Disp><![CDATA[Zillion - aha, everywhere!_2]]></Disp>
</NodeArgs>
</Step>
<Step rID="T44">
<Obj ><![CDATA[Orders Found]]></Obj>
<Details ><![CDATA[PASSED]]></Details>
<Time><![CDATA[07-09-2023 - 15:42:17]]></Time>
<TimeTick>1694081537</TimeTick>
<NodeArgs eType="User" icon="8" nRep="353" status="Passed" >
<Disp><![CDATA[Orders Found]]></Disp>
</NodeArgs>
</Step>
<Summary sTime="07-09-2023 - 15:41:36" eTime="07-09-2023 - 15:42:17" passed="9" failed="1" warnings="0" ></Summary>
<NodeArgs eType="StartAction" icon="4" nRep="8" status="Failed" >
<Disp><![CDATA[Login Summary]]></Disp>
</NodeArgs>
</Action>
<NodeArgs eType="StartIteration" icon="3" nRep="6" status="Failed" >
<Disp><![CDATA[Payback_Project Iteration 1 (Row 1)]]></Disp>
</NodeArgs>
</DIter>
<Summary sTime="07-09-2023 - 15:41:31" eTime="07-09-2023 - 15:42:17" passed="9" failed="1" warnings="0" ></Summary>
<NodeArgs eType="StartTest" icon="1" nRep="3" status="Failed" >
<Disp><![CDATA[Test Payback_Project Summary]]></Disp>
</NodeArgs>
</Doc>
</Report>